main_words,stars
сверш изнутр имеют ссылк сном запланирова окажет ,5085
люк паспортп паспортомп открылв сумк бесследн связок ,3909
успокойт догна общительн ухожен добр встрет красив ,3146
либ прокля долг спав затылок выдохн бумажник ,2917
сразумн отвечаеттак нравятсяон ромебрат приехала забеспоко ром ,2895
кипр хозяев задан квартир арендова прекрасн компан ,3353
призналин почемутовсегд языкпаха учебуникак иняз высыла потрачен ,3055
област назва имен разговарива перееха расста тем ,-503
пмпя дневник бд прочита изменя измен поэт ,1054
миш любимаяпот смысл близк разлетел жизн нача ,1983
пятниц сотруднича устраиваетн денькак распорядок приня четверг ,234
ппц шутер интернетик WOW №т полураздолбан рестлинг ,-2317
полненьк жирн набра кгдиет сдул тренажерк лохушк ,4745
турц ветрянк зеленк искупа отпуск характерн дочк ,1565
ловушк рыцар пропаст защитник почащ эдак неглуп ,4392
карточк пойма умыкнул покрысятнича карточкуп нагрудн проплыва ,2591
помыка интернет кричат родител домохозяйк жит трехкомнатн ,2873
хлипк ужинакорон картошкабер блюдоварен пройдетконечнонобольноблин водойчтоб ошпарива ,2631
смске диктова противн услыша единствен правд стольк ,-979
зарплаткуп айфон пакет трех метр коп хотел ,2797
думаладума встречатьсявс ревнуетзнач моментнача дуракилл дух ненавижу ,-500
погрязн двулич застря поддакива высмеива втро лжи ,-575
выходн компромисс дочк соглаша санатор провест занят ,586
платн прошел сдал исчезнет плоскостоп вуз снимк ,1967
попрос мальчикаон приезжа вагон встрет недолг возвращен ,-1406
справк острожн желан предосторожн полмир аборт погруст ,1549
умерет жалк обащаг грешк позиционир вуз поздн ,1908
успокоитьотталкива повидим вруб вставля рыдан разговор молчан ,2770
никомуник довер подколк сблиз подкалыва назов знаеш ,856
целова приглашеноиздалек болитговоритьест друзейродственник гнойныйоранжевыйсраз мазалан меняпожалуйстапок ,3867
улыбнувш телефончик откажет сообража догна новеньк екнул ,2352
тыщ покупочк пародист докупа капитальн шепта разодра ,2674
ленусик адресова чрез смска приедет ошибк жалова ,4236
выматыва бомбардир вскруж ничерт переступ вставля распространя ,3030
отдельн краснодарск видеоразговор вянут газировк мня времен ,3216
костыл дыша температур обезбалива анастез лимфоузел сложн ,3424
цветет сплю тайваньск именносейчас пральн харьков китаец ,3979
бес могуприч свекровьприч суетлив №№ обижаетс размешива ,677
трус экшн огнеопасн запища оббежа нервяк пожарк ,953
солдатикгранат докторв мячик белочк ползет дежурств пациент ,3282
эфир катострофическ телевизион габарит журналистик пропорциональн телевиден ,2578
брекетын хорошон потомучт мчу длительн перерыв завяза ,-4833
года спуст вернул любим пмп ко ,1892
пышногруд аттестац квалификац переварива промах блондинк страстн ,3327
немецк результатприглас экзаменатор разговорн совершенствефранцузск основеприч языкупот ,4090
пакетикамипригод надроб перекрашива негде барыг амфетамин отодвига ,1567
ножкамивыбр заткнисьид чад заберет нечт теб зрен ,3858
палец недовольн невестк ленив отъезд дням выдержа ,2377
инструктор инструкторт сотреш когомач кафекальянпостел бебит поуста ,2100
девочкубезумн онаон обожж нетрезв надума внуш девочк ,2028
крючк спусков огнемет послуж произойт матерн понима ,3753
балкон магазииин мамааа скромненьк мамаа санузл лучик ,3818
поступа впринцип переквалифицирова сорбон мвд вбил мгу ,-2252
нельз баскетбол плаван диагнозгаймор Osgood хорошомн Schlatter ,2269
жоп требующ недостач миллионер найден вкалыва бывш ,3424
поддержан отказа средн ремарк гимнастическ наклоныприседаниярастяжк поимет ,1264
скандалсказа страшнопристрел ночьмолнекуд изменупоэт домаприхожуон честномн домауговор ,4369
барб мультик опаздыва начальств поход хорош причин ,1222
охранник ящик номер подхож крем вылома снисходительн ,2234
наташ срок парняпостоя апельсинк косметиканедавн науська родн ,4038
традиц горяч помойт задалбыва весел отключа сезон ,1479
kill отворачива pleas me противоположн зерка придума ,3356
дурз уедут диаре сморка цвет чиха досуг ,2991
бдит завидн нехватк неч поспа шеф блин ,305
внук разлучат отказатьсяон усыновительницы глазапостоя съехалаон семьеказа ,3617
мужик светск оклика вруба отвисл неделюдв глубочайш ,1485
унитаз прочист смыва клетк благополучн гранул войнапошел ,2066
воистин впорядк передразнива возомн пробива копир пирсинг ,2610
чудесн вобра любитн нираз сказочн отпразднова костыл ,3243
байк стипенд деньгикмп сильнопривет городэт величин маслиц ,3757
gb половин iPhon днюх сынок покупк шутк ,1390
вместедума сделаеткмп детейв завед ребенк нож мч ,2449
прокладк прокладок прошусход мч приболел магазин ворова ,2938
авар нетв исключен попа увезл больниц карман ,1580
добьют ливен прах взаимопониман вынест придут мам ,1188
переночива пенат мельчайш пойт истор всплыва насторож ,3915
поспа куриц юл преданныйброс свая замужпрошл мужчин ,2432
нин институтск истор преувелич олечк сопровожда мудак ,4125
желез спуска миллионапристрел перевалива хардкорн топов неправд ,2711
испорчен девственниц изнасилова нелюбя макнул оскверн дотронул ,5209
дроваед городаж бедн гостеприимств протягива проживан привыкл ,3673
фотоаппарат цифромыльниц обалдева вручн отдаш радост счет ,3721
вит виктор витюл называ витюх витюс вишут ,4812
грузинк тостух стыж друз заслужива завидова красив ,-4708
щекеещ вздернул одеялом теоретическ ночип высовыва коса ,2762
допитьпмп допива коф начальник спрашива при мо ,2736
рожать… готов… лет… отца… ему…н немедлен слез ,2824
смет отсортирова побегушк жутк этак родственниц переделыва ,2160
другогодруг человекомон пасутся толстая ржатьсил моськ моейн ,1750
слеж фотосессияхон мчон красиваблондинистаинтересна фотонедавн дизайнерталантливс жизнях ,2360
прыщ дяд убереш красова фотограф копеек мудрост ,3357
заданиен чтосред зп работун нетбук сгора потянет ,4397
провожа одинаков переспа умира подруг похорон болезн ,2802
машин губнушк мазд подкрас разукрашен прибьет неожидан ,-2438
карандаш игра невин восторг срыва ненавист всяческ ,1798
мамаш систем сзад воспитыва эйхузер налеп подмигнул ,2949
компьютер скомпенсирова богатств мелочевк честност старшеньк сынул ,1854
масл кошк икр сьел банк облизыва батон ,2992
вконтактеас армиюон улицедом онизанима комнаты продвинут обша ,3881
снам потащ насильн плач привезл снит тянет ,4046
виныт погуб мечта мизерн отработа бумажк оклад ,1810
официальн температур особен район знат внезапн заход ,3380
номинальн несвободн квартират безденеж сокраща чудовищн обоюдн ,2584
вбега раковин посуд прилеч вздул промуча пап ,509
генитал присуд десятк психик сынов брал захотел ,2031
свидан испорчен ушиб порва слома больниц пошл ,1229
системник музык наушник включ офис музон наушникит ,2215
объявлен внимательн мамаучительниц фирмазастройщик польст договор подпиш ,2357
проспа москитн комар сетк окошк жанр классик ,582
пап любовник семьен ееникак страдаетон размазн несчастлив ,2453
потенциальн вслед свидан бывш елоз шибет тапок ,1141
приходя влезл аккаунт разрыва вряд высказа соцсет ,1599
тяжелое парнюслужа инфарктаврач худшемутак армиидадут томчтоб сказаличтоб ,1559
нахер стонут подстригл накрас слышн стон упрек ,2105
парикмахерск покас верхчерн прикольн оборачива заканчива проснул ,-2189
ведеткрив добиласьотста меняспрашивалаответ оплеваннойэт читалиполезл улыбаетсястара замокчтоб ,3056
конц парняалкоголик гранатомет семнадцатилетн толерантн очаровательн родител ,2093
соседк достопримечательн выздоровел неоткуд раскалыва посет антибиотик ,1210
увест миримсякмп насовс типичн зла тянут ситуац ,1084
решилчтоб общемпарен обидетьт думаласегодн понялан бдью ненавидитон ,3189
игр горазд самовыражен самоутвержден уничтожьт скрипк свойств ,4138
мегер затраха наверн любл побыстр доверчив залезл ,4272
горд шла шевельнул отвернут донашива злил здравств ,2528
шкаф выковырива козульк понаблюда стошн спрята слав ,2425
рекомендац идиотк прошел встреча фирм свадьб подруг ,2298
шпилькикмп сантиметров сотрясен упа ти ,1632
евген евгеньевич имяотчеств алешк аич женьк переубед ,1746
уайнхаус эмм довольнотак живущ тошн дедушк рыда ,1436
женат разруша расскажет дочк запомн нынешн регулярн ,1006
деревн дырк романтикатольк теретьсявоня полудик благоуха шмон ,3428
девствен лиш мужчин предлож сын встреча пристрел ,4126
залеп волос спаламуж сегодняпок нагол отращива жвачк ,4474
работник сложн социальн бабушк доверен сред прибра ,2839
татарочк национальностьт мусульманин смен пузыр малолетк изначальн ,1511
дефолт доллар рублев подорожа сбербанк счет всеобщ ,956
всталя тойтерьер спиц собак щенок повторн лома ,1679
месяцевпок любимогопмп беременнамесяцевот тунеядец телочк ебнул порнух ,2754
плеер лежа упастьд упалаконечн какойспрос друзьямителефон заделаслегка ,1425
сектант икон засел лестничн клетк завес подъезд ,2065
подряд замен отдыха вмест компан быстр свет ,-639
заочн книг постаринк затворничеств просветлен наведыва тусова ,3579
венгр поездкамечт трепл плз осуществ просл килл ,-1857
зонт сказаласпасиб дожд науй просекл заман познакомл ,2219
слива полад забавн поржа ржал пул переписк ,2441
нощн вырастут пресека препятств задира доставля допуст ,4389
леткмпн подругакотор узналачт страстн лесбиянк влюбл минут ,1890
ноутбукхорошочт гарантиясегодн коробкукмп документам гарант нахож коробк ,1620
тачк крыш конус аффект владелец разбива слив ,2144
гном подчинен управля сотрудниц организац хренов объяснен ,350
звук кряхтен воспроизвод обхватыва причмокиван булькан мусол ,952
кольц размер размечта обслуживан любовьморков намекнут коробочк ,3776
поцелова секс трет пмп ,2447
аропорт всунул трансфер чокнул мэрик губн крадут ,1871
недвусмыслен динам намек приглас мечта мног чест ,704
клоп охренел твар выкинул дива сплю потопа ,3200
изжог дитеныш безработн прекраща адск пина муча ,2574
запахов непереносим менструац возможно увеличен признак тошнот ,1620
расслабьсям родителямпридумыв членэт судоржн водкудеревя содержаниемпап смс ,-862
передн противотуманк битуум царапинк колодк протаран сигнализац ,1101
студенткотор пмпуста тож бедн радост счет обычн ,3280
разговарива удержива надава аспирантур лжив расспрос добавля ,3837
штрафова участков таг быдл выслуша десят орет ,2676
мызначитпив кафежда тучн плечев равновес лишн весом ,2091
корж умеет науч испечет засмотрел предъявля указыва ,1236
поделатьмн родителимам этогопмп делатькогд папойн невыносима мамеон ,2897
заполошн болта пролог королек никомуник разъясня царств ,1602
фамил озадачива учител однофамильц цензурн отшучива ученик ,-1647
собак молод щеночк переед пристро труп привяза ,2069
саранч параноичк спинк всяк насеком озорн истеричн ,1540
заглянут отписа скутер сувенир пассажир рейс подбежа ,3155
возрастаплюс готовитьубира ухитря прободн ломов праг нагрузок ,3892
категорическ вариант фининсов наращива задава исключен бытов ,966
ноут крышк полирнут автопоржа полирнул полировочн всегохот ,1954
смыва пробова туалет начальниц способн кабинет лицезрет ,1959
подойдут заграничн сын плачут слож чувак пятилетн ,3110
сук деньг откладыва поменя убейте обменник долларовт ,3281
трынд лжив принест шалав сплетн маленьк придурк ,884
фотограф художествен теор фотографирова — полдел подуч ,2026
колбас магазин стукашорох засекл вусмерт отодра ценник ,1931
навигатор деньгамин летомреальн ехатьпоэт летомт италиюпок математикузач ,-653
охранойс бицепсамиустро мэн зев туалетн тачк млн ,3155
каф идиотк парк подругут замахнут приветпок неповторим ,-1430
специалист коллег професс подколамтип пиксел ленц гокурс ,674
изобрета выпендреж метр отвел низк давлен помир ,-1278
великолепнон испаниюкажд аэропортууж могуматушк зашуган матерьюн протестуюн ,1474
жеяичк шоколадик яичниц полива шоколад течен вкусн ,2012
эрегирова близк полугол уеха член сообщен фотк ,1010
словосочетан филфак выпускниц рассыла запомина резюм драгоцен ,1760
милиц срочноинач плеерн курсан пошар копеек унесл ,3377
зарплат отросш отвлечен босоножк беззаботн бикин пикник ,-2501
просрочк сумм собра банк начисл погашен влетел ,2233
трагизм боровков прочувствова подрядн обычн карлик ведущ ,1015
руководител телефон продела перечеркнул сенсорн непосредствен продолжительн ,990
выгляж полиционер замучен неположен загуля ментовск загребл ,1488
гроб смертник истерическ подвернул троюродн привезл смех ,2571
поговорилимн icq ищущ дятел зарега злобн детал ,1306
угаса близнец испытыва наконецт муча факт парн ,2795
зебр самочувств гематом содра обошл реакц сбил ,2701
соседуговор дверьизз холодильникхз отвечаетнеизвинибратпомоч плизуж ржач опрокинул ,1627
задав двор гуля машин кот пмп ,3489
саратов командировк москв отпуск крышк комк врет ,2291
полк томатн косметичк вагон подушк поднима сеточк ,810
дедушк мам труслив позорн родственник скотин состоятельн ,-1584
садизм назадд слабовол склок инициатор свадьб тряпк ,1348
днах проревел перечитыва натянут вслух смски мобильник ,1982
побр копир навра плиизз киллл юношеств непрошен ,3057
сестр попрос деньг долг подарок конспираторш родител ,2391
едуоригинал заведениикуд колледжрад вылезалапоступиласчаст пределаотправ могукмппожалуйст вчерапоруга ,2606
листа колдовск заклепк нотн карточн ежедневник шиншилл ,-433
домойоказыва турциюоперац операцияотч забралпмп прилетадовольн постоянновот отчимс ,1946
пакет человекомсдела подаркаобнаруж таракановстрашныхбольш квартиредаж подароктак случилосьчт ,434
халуп свихн вычеркн принадлежа завещан прописа угроз ,2914
далек обьект работуустанавлива бедыоднажд добрат единиц кондиционер ,1871
забежа супермаркет машин сигарет соответствен останов везл ,2450
подруг жирн толст косвен проскакива изможден худощав ,-1223
завалива ваш позволитьсегодн летвстреча пожелаешьозолоч рассажувс семьипристрел ,1387
чтоыб соблазн складыва потребова любовник проща обижа ,2196
братупристрелитепожалуйст нообычн уважаюн себесчас браткотор коснисьв наоборотвсегд ,1998
лучш влюбленв язык посплетнича кулат сворачива приближа ,2343
сдаш вытрепа написа помогут деньг рассказа перешл ,-2399
ложк вилк рявкнет запинк произнос координац слог ,1692
годапридурок совхоз процессор нафик ветлаборатор землетрясен пользоват ,433
хозяев выут дабл трубочк храпет сьемн ориентац ,1195
кровиизз языкат сознаниянарушен диабетв диабетасимптомыпомутнен кинораньш срываизз ,1811
кндр подмета довер рубл загон подорва неблагополучн ,4477
разруга деревн мелоч ребенк сын вопрос безответствен ,1824
девушкевс вместеуеха религиейраз промыт пропа мозг бог ,2026
артем изнасилова двоюродн потаскухой любимыедорог дядейтет оказалосьродственничк ,4708
добав фейсбуквообщ парееньзнач такиеврод дураспрашива коленачт фейсбукен ,2056
бабушк безалаберн волгоград никудышн слышим любопытн отличн ,2852
зряч слепот сетчатк врожден дефект нечая дырк ,3865
расписк герман считаетчт лузер соглас самолет заграниц ,2301
