main_words,stars
галочк номер боллид предчувств нечитабельн супергеро видн ,-2414
отчет директор черновик отправ кончен мусор зря ,7852
докур поджег курильщик бычок постройк труслив забор ,11163
уеха переписыва синяк разреш спрашиваютзач нашл завезл ,16182
хохота стеснительн неподалек поскользнул подойт дыша жестк ,14987
небрит топик совершен запуска эпиляц подмышк покрыт ,10766
анжелик умота впуст отец двухмесячн девятилетн намеча ,16595
чердак сверх подумаетен чердаквсегд домуправц визитницам оттудабледн ,16671
Puss Rammstein клип кинув мч ворва вышвырнул ,10492
сын берет милосерд электрошокер кодл разберет поднимет ,14313
дежурн звен учител урок учебник четверт выбор ,16387
стоимост кольц нюанс кред причита рассчитыва свадьб ,3280
паранормальн спат вертел вылеза заснут нафиг впечатл ,4909
дочер позвонк обреч смещен дверц старин грохот ,10701
корабл парус катт старк киданул обломк метров ,6418
почк впадл спасаетпристрел тупорыл успеет диализ отмазыва ,15463
прочел простуж горбинк гнусав выпрямля операц хлопнув ,11583
отряхнут подня мч копчик поскользнул снег ржал ,8656
нвп афган добродушн директрис оценок отстал воева ,13470
офигительн растопта позовет брак суш страниц вконтакт ,14494
воображен дотронут страшненьк ктонибуд игнорирова психушк исчез ,14898
хлеба недовольнас вставалаон станетт вниманиепрошел мамасам отшучиваласьмам ,15264
картон нарушен сниз ковр сосед тишин высел ,19505
ейжив простоб заявляетмам детальн ангелочек протянет сифилис ,19568
воспитыва родителейнадсмотрщик модернов отхлеста беззастенчив накосяч продажн ,14688
липосакц толстот спасет сойт йог фитнес расстраива ,11259
шантажиру душещипательн братец несостоя произошедш поведа сконча ,12231
брат бухл алкогол рюмк нажима конкурент расслабля ,12950
кир няньч прикипел детдомовск слабак архитектор хочет ,14268
провод хохота братск шуточк сблиз присутствова стона ,9029
завеща сдач умрут помоек майонез пропива проигрыва ,15380
матюкнул яркокрасн милостын таращ покрыт смартфон рукав ,16418
вискар разукрашива свом окошк свидетельниц покрыт татуировк ,17312
красавчик шрек затиска голливудск какомнибуд откроют сосчита ,14692
паспорт перекантоват бистор угон антал идеальн отберут ,13203
другуючерез проглатыва прицепомушел ухоженнаявсегд слезразжирел такаяж смущаловлюб ,13773
уматыва бездомн кричат перееха собра сексуальн однокомнатн ,15619
отчим воспитыва засуд отц отмаза пожарн добр ,10294
деревя закроют здан садик пожарник санпин противопожарн ,11060
братишк взросл пятилетк перерастет фантазир прислушива слышат ,12540
молодн подтолкнул необязательн невольн допуска очаровательн печальн ,16675
задан предмет читальн доделыва гулянк универ неч ,15058
похож лицомн интимфот отместк HTC разосла лопнут ,12547
кошмар кажд кусковзрелищ сне сшит наяв спат ,10678
тюрьм дрян мамочк убийств кремирова ейждет пьянчуг ,13901
проявлен надпис ручк слушател подавля неизмен тревожн ,11766
подкараулива чемоданчик влаз обзавест женушк выперл насел ,11080
насест разбитн рокфеллер сырк использу непомерн ошива ,10123
кухн диет похлеба вафл пкм голодовк шебурш ,10760
волонтерств дрыг любы рыководительниц ыспокойт выберет информационны ,8484
насра потепл поверхностн глубж задумыва душевн накорм ,8364
конверт старост малообеспечен прокана онатак пожертвован групп ,9743
репетитор сообщен подругамидневник дочер липов доверительн нерадив ,17532
перепоступлен лошадкумесяц сессиюпозна переползл труднееч подведеткак предполагаламног ,16905
ворова куртк старшак облав слеучайн такуюв вораотпрос ,13006
сумк тряпк захолод грохнут чула общаемся швырнут ,15429
дорос генеральн совещан управлен поздорова проработа задума ,5979
наденьк решаем подарк жгуч пристойн руководя хлопот ,14090
стесня брит прящик преувеличива усугубля рассмотрел раздражен ,7268
откровен мелк покруч босоножк попк бюст сестр ,17339
блоггер другприколист пропозор отматер подписчик рейтинг нахам ,5276
польш блджад квантов польщ препожаватьт бортов художникдизайнер ,4726
романтичн каблук науч простушк сдават идеал кроссовк ,12969
швырнув фортепиа науч завидуеш гнатьпочт заклят сумк ,17913
неблизк дед зеленоград югозападн задумчив дедушкин схем ,9575
изобраз розочк покалеч сыгра связыва псих когданибуд ,11214
побольш туалет бумаг рулон навалитьт классух штанишк ,26794
стыдн квадратн недвусмыслен тусова постарш панк наутр ,10980
подвезт y требыет продыкт давайк ыпрека свысок ,10762
анестез привкус язык откус пообеда поэт удаля ,10159
сосед таааак насущ приличн каталог двухнедельн шумет ,9018
наташеньк тещ улыба ребенк ауел тычет полтор ,15307
буха анализ презик напута собутыльник кабак юза ,9575
подруг имеел пятиминутн автослесар щиколотк научат буквальн ,9904
очухива постаревш аудиозапис смачн колв запомина смотрет ,12586
вторник проигра пипецвстреча прокрут заявлен отыгра наката ,3540
— выявл снача узакон патолог узнава помн ,15423
бывш задрожа разрул лгу рву прокурор мучительн ,22896
френдзон ближ противоположн познаком красив партнер самоубийств ,9845
махач завлек глуповат братюн чертовск качалк сожалеет ,14829
чашк поверхн мобильник тарелк лежа стол предмет ,9174
уведен собак близняшк надела прическ ворова мужчин ,14950
укол медсестр врачтерапевт гланд сосуд предыдущ колол ,7075
зачет уверен книг сапинсказатьчт отчисленияруш преподавателяпожилогоседовлас отличнозат ,11263
перегрызт навесел помолвк общен подруг разревел глотк ,11112
звон кмпидиот гопик настырн сбрасыва избит удивлен ,17306
девочк нетусообщ яучител вродеб отц неопрятн поспеш ,12822
приня сочтут висельник раздражительн санитар щелкнул слабак ,11379
сын нянчат хибар подонк натыка развалива пьющ ,23101
пмпстрашн боемв прокисл всенача магазинагд подпольн рукопашн ,8795
саш назнач психиатор затуман глюк пика красавц ,19139
отчим поотцовск врыва бормочет жил истерическ предварительн ,17848
злост сочувствиепмп богат парн вымеща парнемста замуж ,13113
ушел домел психанут метл подмета замел раскрича ,10948
плюс кровоточат коряба стрижет негигиеничн диване отращива ,6326
огонек наклеек пластыр закле стикер ноут понялид ,14545
резинов ушлаон звонилписалприход машат неготелефон парнявстреча внизжив ,9940
мгут редкохот муравейникемуж муравейник снеговик шагов ростов ,9953
мелк бизнесьм производственник лексикон офигет торгаш улыба ,15063
специалистаспуст нормальмальн иероглифысерьезн прикажет спин удод эскиз ,17108
школеприлежн домалучш масштабн остановит нетрезв учениц превраща ,6333
туалетн бумаг туалет увид молод больш перв ,12508
фруктыовощ наест бедству предложат отража обидн пацанк ,10439
похорон перевернул предыдущ сгорел машин дво четвер ,33349
узналачт придут героин торг обожа тряс старш ,8768
призна младш лучш отец брат сво друг ,11779
усыновлен забеременет усынов пустоцветк призыва озвучива обалдел ,10492
трога соцопек брат проверк рассказа куриц жесток ,12678
прем ресничк вынут пошл сигаретн задува пахнут ,12322
доч мачехаподруг особнячок супертехник гвно потерпет поменьш ,13841
вместе мамыкотор рецептамон доскитк фильмон папавчер домаготов ,13551
отойт бдищ аннэт непотребн раздавл поможет расслаб ,8299
бьют сотрясен характер восьмойдевят ботаничк сросш другихт ,14201
девчонк знал сосца струхнул заподозр анонимн поржа ,12618
лестниц письм красивоочнул старшекурсникаумн могулиц уродинауб сновлетел ,10321
татух пап расстро наколк шарахнул топик замет ,12831
долб поумнеет сынастудент дятел поумнел распакова обворова ,11606
насложден таккак косточк неописуем крюк раздира режут ,8124
торт восвояс сестр ушел прокорм попроща какт ,15292
путин письм напиш текст начирика генератор хоссподебож ,-2606
мебел демон шкаф свекров продергива мужут дьявольск ,9262
эмират бизнескласс гребан самолет каникул шмотк общежит ,9298
лапа слякотьеха сзадиобернул подмигнул кавказск иммигрант учителя ,11619
тигренк дрессировщик поглад разреш дал дума кмп ,4369
умножен таблиц дает подколот поумнича перехват единиц ,7091
модн одева рубашечк побываюттрехкомнатн приговорпмп мамонт аксессуар ,5057
ракет обратн был повестк посыпа стран восторг ,11758
линолеум интернет ипотек вариант сгно высунув фартук ,8666
хозяев хлебон девушкойстудентк надума потака прихот навра ,8207
адаптацион маамаа пятьдеся дерга зовет схож период ,8079
отчетлив присн голуб вечеринк какуют клуб чемт ,5166
книг тягостн подспор сглуп увезт дед дедушкин ,11795
мартин пятерк декабр проща сесс самодеятельн соцактивн ,9620
угрожающ отодра отч макушк вытира вцеп утеша ,9172
сосед женаш догадатьсячт рукеразб соседипомогл лицотак рукахпод ,14458
середин диоптр фокусирова макросъемк наполнен ослепнут индекс ,13274
магазинес собственнойдружн класса узнаючт многодетн встрет бесплодн ,12628
провожа кинопоказ поднимеш киношник замешка напечата понов ,10750
пожен предпоследн спровоцир отвал ребенка сдохнут заодн ,14931
уверенначт обидноесл вебку купилатак радуетсяблагодарит мечталкрасив деламз ,8900
пустяшн злил статус пустяк употребля сирот лекц ,12090
никит краск пятиэтажн никак обычн вывел девственник ,6634
задолжен заработн вынесет куличик приборк поручител помощ ,5725
полициюоказа доказывалчт меняпожалуйст незнаком совместн показыва фотограф ,15451
скорост наперерез кмч трасс отмыва передн выбега ,7805
вечнобомж группировк шпионк пареньточн иммигрант раскрыва сущност ,6244
шкаф пада стенк выкидыш задн молоток пошлет ,13639
майор прокомментирова подспор произвел бойк вкусняшк обреч ,15023
мост помогитепомог осталсяход повисет щебенк носаKмп самоубийц ,17823
сошл детск дик сад забра сканда устро ,12496
обманутмаврод квартируработа копилв коммуналкепмп ничеготольк возрос итогн ,12943
быламн полусмерт избит проведа выбит уродлив ревност ,16047
отъеха расписк поцарапа бампер лишен царапа придурок ,13614
кавказц патриархат детьм разгром подчиня попорт защитник ,16041
течение емуиногд выплылкогд выплытьхот богапрошл бесконечновот берегаон ,17369
надбавк бюджетник вуз библиотекар диссертац станеш наук ,12620
дестр страстност лер андрогин озабочен имидж схем ,14878
тюбинг месяцевуб паравозик сберегл рождения катан трасс ,8388
жених всплывут отправител уеха передернул спб выписк ,19124
кутикул ножничк почеса одноглаз чеса удален нижн ,14800
пиджак возврат паспорт запростестова отсканирова девушкапродавщиц унесл ,12810
раздавл крым кусочк рухнул развлека предательств всяческ ,10799
париж франц самогон гостязакон другграф аристократическ хлеста ,10565
детишек ребенк осложнен мертв племянник отпуска смир ,13612
йод област болячкам полиэтиленов ладноесл откроеш медицинеч ,15697
захочетпознаком предателя вошел отдаст стремн конкретн познаком ,10934
бумаг окн салфетк листок чтоспуст утилизир удосужива ,10206
гороскоп сочета парен брос узна кмп мо ,7076
пив бутылок пью задумыва прекраща прекращ набира ,9255
бабинск рефлекс опухол пальц хондроз веер обездвижен ,12433
воткнет проглот иголк какойнибуд вдруг орга случайн ,14014
встрева углуб разговор приглашен свадьб знаеш ящик ,12878
машиналестниц окн огромен подсказа подъезжа какнибуд кемт ,19027
украин мюнхен давнешн укатыва оцепенен колебан фэйсбук ,14125
рабовладельческ кормежк заносчив интернеткаф сельск фонарик продад ,13445
конфет девочк девчонк вундеркинд занудн пластиков гнойн ,21771
дочк переодевн начальник встанеш родн трахнут компан ,16643
дрыз загс свадьб наплевательск дрыгы смскы смотретьт ,12148
свекров такс дрязг галлюцинирова таксопарк ноч матькукушк ,20792
укол муча температураел больницысиж дошкандыба докторамчт общемсдела ,14433
мноймо уйт анжел комочек разлад укладыва дочк ,13209
другкартошечник нашептыва перевезт любезн мерс будьт драл ,8336
облыс агент придурк онлайн беспоко причин разговарива ,5179
лимон ааааблин цитирую погоня покер дозвон неудобн ,8345
сестренк завеша запис зверск иска мам сет ,14587
сверхурочн поредел лапт отстреля желан корректн постарел ,11524
бутылк откр мужик женщин содрогаетсяупир плечокакойт спрайта ,12942
босс хипп арбат женьк электричк партнер площад ,8814
залетел уламыва невида аборт грызт директрис сучк ,11617
стипенд задан подруг отобраз суперважн переживеш листочк ,12648
бесплодн годаспрос другогопрошл девочкиблизняшк свадьба детей навра ,14143
кроват щекочеш ребяческ подслушива свиса щекота выполз ,7991
тогокак свечиклад деньвздыхаюзадува завтрам холодильникснима чулк безусловн ,8002
книг издан коллекцион расположен насторож произошедш игрушек ,8919
вспышк любопытн вылетел окн стекл взрыввс прогнувш ,10294
метеоритн паспорт бомжапаникерш деньгителефон искарежен домапрактическ дожд ,8140
чесотк зятек мучительн стационар зараз блин половин ,6365
курилк подмигива кобел недвусмыслен новогодн пьянк подойт ,8742
психологанашл родителямиреш помоч наня переписыва тайн контакт ,9610
заботлив кругосветн битьбитьб милашк брат напортач клаустрофоб ,13048
хроник криминальн преступлен телевизор показа соверш брат ,5346
напичка отравлен испорчен рынк дрян овощ выкидыш ,15877
егорушк бесплоднавтор сланцахон вернемзавтр пускала поселилаон зиматемном ,17369
посуд рукоятк придвинул гнуснав помурыж этажерк бабос ,18019
отпуст джинсы монашкукофт давала маек убереч протянул ,13328
утечк дурдом газов истерическ рыдан падчериц донос ,8926
впорол восемьсот стимулирова кореш стрелян моторик башн ,8943
чех марьиван выпмп бар навесел неплохая голланд ,11370
хозяйк свалилсын ипотекупрошл отказывалсясосед житьнемн планукак обывательск ,12774
суд инвалидн алимент заожирен извещен жрал удовлетвор ,10689
психбольниц психанут утеша наивн прекрат знакомств депресс ,7175
слушаласлуша бездарн сестр любимиц сестер неглуп талантлив ,10152
пианин примерн мелод заигра возражен игра стенк ,8522
посмотрел полоборот гарнитур окн шутлив чепух трамва ,7012
обувн ноутбук пуфик скайр покопа вдвойн готовн ,6662
недельв пластмассов верност сравнен носк пояс брит ,-3641
подвез даш погрязл заподозр знакомл лжи зовут ,5459
сапогиз школыт охренелам бедн высчитыва сможеш вернут ,9666
идут кажд месячн недел идиот оказыва узна ,8474
телефонзаяв такид кмпкурицакотор милициючт менячестн милициейуб позвонилачтоб ,9084
пакетик сумк корсет чулк багажн турц муж ,12003
итогпап звонк достава мертв степен ночева вспомн ,3657
девочкудочк планшетник незабыва читалк гаджет приставк смартфон ,8834
гобел эпох ильич рокок антикварн наяд раскладушк ,8923
мыж y свекров мамылечк посыд одыва полыча ,13832
петард воткак мощнаяп результатмен многоэтажек тропинк оглуш ,7731
сект мамочк вставш несколькотлет подросткомпанк полтинник передышк ,8888
любовник трубк смс растопта браслет подставля спим ,9154
детк умеет воспитателемгрупп негобудеш шокемальчик плохоадаптац беременнаодева ,9740
лувр скучн гостинниц игрив лягушек несварен вылов ,8492
ждет образованиемперед предоставлен говорятесл фирмымен делатьпмп увезт ,7018
сестренк пап комнатк летн принадлеж мам негд ,8500
минет сперм втира гениальн привяза пальц забеременел ,9276
