main_words,stars
двухнедельн разлук выходк соскуч звал надоел приеха ,5281
итал сраз жутк салатик брат парн аэропорт ,7870
стерелиз кармыкмп кошк закон тип счита мам ,4926
сестр косух доширак понянч рокер проплака младенец ,8039
выражен офиген удивлен сдох придума крик стен ,7617
ущемлен конфискац изго безобидн психотерапевт гноб встрет ,14022
трус надет пораз шорт футболк штан ищет ,-3253
нищеброд духистоя непредусмотрен несусветн работаютподрабатыва шоппинг надоел ,8045
сплю охренет страдалиц несуразн кинотеатр спат нифиг ,8787
металлолом полпут баньк подземн затар машин нелюд ,19468
приходитьон придт вскоч проспа позвон обстоятельств добра ,11227
котенок тормоз котенк примыка закт девшук педал ,12810
вожж теплот бисексуал шведск подругин ужастик такж ,2716
деньг синякахссадин прижеч школ повер шкафчик полусмерт ,20086
растека мгновен девственниц слух тверд аборт ненавид ,6574
ребенк всемер соврат кроватк однокомнатн отлож коляск ,14527
зря подкол бесед миниюбок модерац дикц чесслов ,6618
выключ братик поссор онлинеигр игрум компьютерпостоя wif ,10311
пес пса девк люд выдрессирова тронет заблуд ,12792
пылесос полк стул вопл приха робопылесос программн ,12380
совместительств оскорблен завид защит брат замечательн настоя ,3919
телефонлучш проститутка двуличн маменькин эксперимент лжив сынк ,9404
викенд париж любовниц соседямиалкаш парикмахерш тридцатник ларек ,11168
просьб видимовыда отец подарк галлюцинац разруша дела ,9445
сбрил бров спал младш брат прав пмп ,8801
испуга хохоха выпригыва скример подруг хахах конц ,8872
камер шкаф самзовет вскарабка шашк пишущ подсветк ,10129
The спроситьт Budd Pennywis Clash Holl слоупок ,11688
алкоголик недостак подберет машин встанет наращива шапк ,15079
ноут крааак назавтр онемел раскрут рыдан усел ,15319
знаеш тетим себяд ентпочт кружочек апелляцион закрас ,9618
сошел выйт предложен замуж ответ ты ум ,6884
стринг сестр плейст натянул семейник вырисовыва караок ,9274
маргина деваньк швал рассыпа счастлив расста лицемер ,9765
помогл работаюмногоспл подмоскв работаонлайн прокачер казастах шлюхапольз ,13120
всчтреча стдент покака крыльц поспор жадн грех ,6762
прокалыван ноуха радова запал насовс сработа оправдан ,5828
публикова написан задар комментар окажет герман опя ,9362
бар успел телефон привезл отключ SOS абонент ,24093
прокладк бассейн аквапарк горк выплыва оглянул пмс ,9247
полчас тенечк отсиж бгу тротуар лежа солнечн ,13607
справк асоциальн психлечебниц недееспособн экспертиз бакс наклон ,12720
гараж допрыгнет попрыга нехил поспор высот расстоян ,5271
отмер синильн болезн порыва деменц девян накинут ,13500
подмышк длинющ длинноволос кустик человеккотор брюнетк брил ,13357
кунжут кунжутн остановок булочк чешут орех покрыва ,8627
коменданск аптечк сопровожден хрома приболел раскалыва подвернул ,8754
сжал прыщ кулачин грызанет рефлекторн губ контур ,6157
концерт дискограф несгиба фанклуб перепрыгив подворачива отколот ,6812
придумыва произвест суперзнаком сверхвпечатлен какиет приписыва монолог ,10746
покупа бытовухекакиет мочалк сервиз естьн шопоголик шлепк ,3684
предложен седьм замуж подруг выйт сдела неб ,5891
дозатор водичк потянув соскальзыва откроюк зуб попива ,3866
проклят алчн свыш ключев рубл дерут медик ,7500
кредитк достоевск выбра вскроет верм лим забронирова ,15067
воткмп общатьсявот предпочита хренов людьм друг зам ,5182
выскаблива падчерицазолушк моюскоблювычища всегдадаж херов приезжа нифиг ,5566
попомн настеж восполня рекламн судорог агенств опухл ,11160
бабк подруг говоритмам толькок бабушкеведун предугада протянет ,5004
мужеподобн непривычн шаблон привыкнут покажет мнет представьт ,8777
снижен бессимптомно внедр легк кох кофточк палочк ,8371
стыдн размер применут белья наскреба семиклассницы безгруд ,7809
пролетел посла позва подава институт пошел потеря ,5752
наставник духовн пьет замыкан нелюбв мамин лекарств ,13306
забеременет аборт застав брак постоя хочет дет ,10869
свадьб приколистк хочетпмп шуток пошут перешл загс ,5546
смс девичник номер прочита обманываешьн дажен пошал ,12156
пластинк подлож железн делод стопещ доскаотпад ойвнучадоск ,8508
насидел рулетк письк закрыва чат виж глаз ,-5535
отбира тиран учительниц грамматическ воздействова запрут предусмотрительн ,8824
свистет утрир сумашедш храп снотворн уснут есл ,8930
тещ посолидн чир укладк слета обновля памперс ,17792
преппарат предрейсов спечиальн алкотест машинист проход кровоизлиян ,10413
закодирова вернеш пьянств найдеш почерн ворова лестн ,7470
бодиарт потн измаза забыт пьяниц вонюч бока ,-2771
бабушк сведут ивановск эксплуатац немощн силк поживет ,8578
посмотрел экстаз воздейств мальчишник чувак палец отреза ,8860
догадыва хвал уважа одноклассник учител аборт никт ,6626
машинеон собираетсяпмп машиныкотор былатк избилавыгна подругасейчас возвращатьсямн ,14209
предк превозмог собойсход рациональн выталкива айпод идеш ,9307
вспыхнувш беред полез наруша транк отклон брачн ,11620
поед жрачк полуфабрикат стимул листовк раздава денежк ,14947
PS захотел семейн эксклюз тьху игр имееш ,11315
телефонкупл айпадомкупл предоплачен модем лодыжк рубл вывихнул ,10729
наркотик пробова состоян пьян плака рассказа матер ,9347
стил тинейджер побрякушк копирова копир кед популярн ,6908
занят книг беспрекословн жгли уничтожен отберут волк ,11421
бутылк кваск окурк квас подброс удивлен неожида ,3963
туалет расстегива макдоналдс документ урага коллег крикнут ,13727
правнук автопарк осадк безбедн вилл яхт покля ,8011
мелк пролива стихл взыгра перетащ намекнут очуха ,11655
ром зовут роберт назва хомяк независим физр ,4956
расческ братик волос кож расчесыван шелушен зудет ,19571
догадыва изсижутряс отрочеств бездумн всплыл виртуальн предъяв ,7178
подругин балл набра бюджет платн друз называ ,4648
балкон амстерд конфетк закончат сводн путевк заодн ,17992
страниц понравл фейковн общениевс девушкис великолепноинтересн любова ,17787
кист овощ замедлен лопнет трепанац голов рентг ,17496
магазин беззвучн пропущен неимоверн позаб задумыв достава ,9331
поворачива сдюардесс словарик посадк стаканчик москв искос ,9419
продавщиц морожен подозрева поезд укра ктот попрос ,4266
скоройчтоб порекомендова доеха горл укол реанимац аллерг ,5068
лагер отряд прославлен неугомон неблагополучн извинен старш ,9132
чистюл водян родителейнер стипух неопрятн нерях пыльн ,12464
покуша колен встал сказалавстан бабушк капризнича эгоистк ,20351
извинт собеседник отключа полдн позвон уточн телефон ,6693
резинк стирательн потерпет протягива презерват ворч кабинет ,2745
животинк машины выман покорм кошек изпод накорм ,9731
подарочк эротическ фот взам опозор цветочк руган ,5820
пакл сожжен сбрил побр краск понедельник порог ,9468
врал ненавиж безвыходн подшучива недоумен задыха пошут ,8941
единствен мелоч ниточк обруб сынинвалид добыва бутылок ,8405
кож помоглипосмотрел зеркалотуалет косметологаособен повезло простуданакуп выдавилас ,6354
мч расцарапа маман искалеч порыв увидел настраива ,7575
никотин амбр гланд чмокнул втихар разруша забива ,6930
перел гипс какой—т долгождан форд транз вытолкнул ,10842
концерт звуча дорогущ песн клуб билет пуга ,5746
выпендрежник попрыга скинут травмпункт пирс попробова скинул ,6719
утипут предвеща прорва палат душ похож дочк ,12608
левш найдет взаимн встреча урод нормальн чувств ,8939
парол фот помн прокомментирова смутн подлост дурост ,-2220
детидик стыднол матомряд психвс горкахора ничегон американск ,-5615
земл слыша кэс птушник вобщ высокомерн рожден ,8260
америк расчетлив денежк детк отцовств исключительн нужда ,5517
менясер парнемпрошл мнойпредлож мышькотор бывшийпознаком годпристрел вспомнилчт ,13275
темуон похожден тогочт наутр необычн поступк неадекватн ,5475
платформ A a сорва испугатьчтоб плечинамерев знакомыйн ,11521
скорост мчал детоубийц мопед злостн встречк отлетел ,14018
шляпк некрофил фотк фотограф возраст смотрел увидел ,4539
итальянц сифилис поитальянск губ бумбум взасос язвочк ,9613
съемк фотографпредлож типажу фотосет съемок гиперопек прикле ,8456
фирм кажет евр потеря изз пмп ,10220
нейзадира подбега кофт стесн груд корм младш ,14153
репетитор шкаф перехож любовничек углублен изучен щел ,10663
кошек отпугивател вилк собак бабул ультразвуков затест ,8719
глазамиблюдц демократичн обсуждатьчувств номинац замастурбирова наподоб форев ,7531
больницадепресс прибавлен лицемерн выдума дрян толкнул лестниц ,10176
нелюбим ребенок любл люб ег родител жив ,7711
рабоч работекмп химлаборатор расстегнул мдаэкземплярчик ухмылк молн ,8427
прошепта обыден вздохнул комментирова арм променя служб ,7250
смехотворн шью детств мечт дизайнер литератур всерьез ,4874
отпуск усмешк начальник никак восполня несладк смышлен ,7326
законнорожден времен умерл сын узна умненьк молчалив ,9028
осыжда заслыжива сыд мраз сволоч пыл оскорб ,8582
головк карусел запрыгнул пацанчик хмур перепуга изда ,13732
сперматозоид погиба незащищен попадан засунут оброн клизм ,5524
концерт слейм панкмайк фанател буквальн потн пляса ,7202
фанатк лукас коллекционирован светов завеша вейдер шлем ,8408
вспомнитьт прожит оглядыва мизерн молоденьк деска замуж ,15911
помир угорел ссор повлия дружеск пересп сюд ,6436
отц поощря корыстн шопинг игрушек кукл всяческ ,4454
мозг клеток ухудшен чемлиб сосредоточ общемт попрост ,11157
медов садик дружб всем вышел замечательн вмест ,4891
фильм триллер проектор попкорн скример мч полминут ,9247
училищ коекак балбеск головокружительн трындец зависет посильн ,7500
молокосос безлюдн переулк ничтожеств летн череп придурок ,11778
озер трус развева тарзанк овац прыгнут утонул ,5872
слома показыв лев ног прав друг пмп ,14717
нескромн одева достаточн университет налыс восточн закупа ,9269
мужчинойс дубликат принадлежа порошок втихар доброт бт ,11137
озонатор Uccider высохш per подохн нитрат килорубл ,9115
катышк обработа дырк удален машинк принесл вещ ,-2507
благоприятн расчеса мотор будильник ловл ваканс проработа ,5586
фантазирова пятикомнатн бесценок заселя прикинул проторча отжа ,7342
английск Excel Word Windows пользовател нахвалива заморачива ,4704
неблагодарн убра суткитак маминон чаев аванс превыша ,14302
кольц экскурс cообщен музейн извен over нафотка ,11464
снима узбечк нетнад живут естьп трист панел ,12498
Jav онлайнлекц бакалавриат программирова документац умеют компьютерн ,5143
жует диет похудан нож холодильника пробежк кухн ,9055
слегк зависл похлопа привязан задуш прижа обня ,8989
выбежа слома дрезин зрелищ выпрыгнул пьян угомон ,9683
передвиган забиран саньк приукрашен слышупомн представля прервет ,8095
брат вознамер перепишет крошечн непонятк собственник выясн ,7194
заказчик исполнител посредник переулк пожелан перелома передава ,6537
десятилетн менеджер страниц сайт фирм сфотшошоплен грамотамисертификат ,6017
небезобразн дьябл скилл дымов демонахантер расслаблен пукнул ,9230
некрашен выйтикмп татуировок подлец волос побр лыс ,14824
друзьямизнаком матушк коробочк надева апрел стоимост запомн ,6244
проблемавыпира обтягива мат зачемт сынк придт скамейк ,8416
экзамен уверен занервнича разлива чувствует произнош гипноз ,7594
попрос обвес посуществен безвозмездн скрив жутк прибыльн ,10973
евроокн предк установ попробова кпм реакц выпа ,3592
четырехкомнатн джип летн папаш разор продаж вынужд ,7871
мнезавещан короч потомучт задава передава повзрослел козел ,7900
пересла пипец жалост изменя истор написа нашл ,15979
покинул коляск инвалидн прикован милаяулыбчиваякурнос номер ашан ,17130
мурав бумажк насеком вывест вынесл десятк дерга ,7344
лампочк высот желан итогесотрясен неострожн стремянк медалистк ,15799
пакетик шумок подорожник лекарствазл колдрекс гомеопат недомоган ,3930
неестествен мусорн приемн бак рассказа извращен вплот ,14162
антресол бесконечн придурковат запыл просушк вывешен экономя ,8224
плеч всажива подкра шутник разворачива предупрежда картошк ,9856
двер ключ братьт икеевск кухоньк поставлен доисторическ ,9218
недосмотрел помягчел ребенк молча привыкнет пруд покерфейс ,17880
сайт посвещен догадок шарашкин срамот поисковик непристойн ,8381
рассказалипмп взаимн днях спин провод спокойн рассказыва ,4134
англ францияангл болельщик загипсова рванут прикладыва матч ,8394
пообсужда упуска ярк отц вынес косметик комплекс ,9814
кож хайлайтер лолит консиллер зеленоват губ светя ,13253
изнасилова бесед мил комнат сейчас отц человек ,11576
загоражива запрещ центр сбежа воспитыва выдержа всю ,7776
стих песн пистолс недоигралахот поэз досмотрел квест ,8914
пошел добавк свернул наутр уснул лестниц дожда ,8630
окончан мехмат сгнит вуз уедут школ переживет ,9220
ужин сисадмин каф опрятн надева свитер заинтересова ,5184
дедушк думалчт WOT бьющ украине захват знающ ,9074
площад неудачника… попыток ненавидет повыс презира развал ,4792
шашечк приведет обочин почерн подбега незаметн какт ,13520
жилиж окольн понялчт запримет пересека рассказа прибежа ,5681
колледжуеха друз цивильн накрыт довольнотак гулянк выпивк ,6408
каркас смски адрес обплета приеза галере изменщик ,11333
собеседниц трхал слабачк аэродром приволок увест служебн ,6597
ворот стороныт заносчив весом шелков хоч пустяк ,6077
ханж пьяниц трезв вечеринк бабк угод возраст ,1651
кошек вислоух шотландск рожденияк либ заткнул опека ,12090
сфота улицеоказыва окнокотор девушкачаст капляхоказыва дождлив голойпмпзавтр ,7350
поступк котенк дружк вродеотвезл одноговс пидяек зубыувид ,8919
пацифистск пацифист вечност прострац солнышк убежден распространя ,11255
однойединствен интрижк стриптизерш апрел нрав чтол разрывн ,5173
приблизительн утащ перезвон подворотн приключен сброс трясет ,9189
рожден подарок дня помим расскаж пропада наивн ,7573
брат полузнаком отмалчива переглядыва братск старательн рассказыва ,10735
выдернут гражданк слезлив ветера воева горяч поед ,6619
обним плюс вижуслыш теляч схорон пережида мужествен ,8635
планшет наладонник андроид отчимт богат посво яблочн ,7281
ученик затрачива урок коллег обновля сельск фанатичн ,11376
сковородк масл фейр хлебушк зазвон пузыр кусочк ,5357
зачемв вслез доста эпик крик стен идеш ,9531
маленькогочертовск паркмашин хочун пострашн потолст глубин медов ,15600
ненадолг годк прибав вру произошл знакомств парн ,5143
соберут поскальзыва лучш чемпионат кипяток фортепиа чайник ,13088
входн полицейск мобильн хозяйк смешн заплат соседн ,6100
нарезн охотник лро вороб киллер лиценз аванс ,-2002
забеременнел ненавистн отчим мам аборт обидн прич ,-4406
карточк благотворительн грив взнос снял добровольнопринудительн смс ,10909
пришлют утрясет естессн курск мухосранск грец отказа ,8137
остановок вслед сзад автобус идузначит акуетак лопес ,-2066
молок проваля отвлека гребан воспал встат горл ,4549
лотер высла интернетспамер миленькая налог неизвестн годов ,9125
съеден оптик цвет прелест сладост ухажер конфет ,4512
гепатит арм батеньк сдут войск комплексн уберегл ,6779
