main_words,stars
трубк пакиста дошут хрипот прокурен прикольнут сбрасыва ,949
травилипмп сполосн бизнесцентр таракан администрац чувак чашк ,-540
мизинц лопнет вытерет обдела торчат неполноцен посещен ,3094
царевналягушк подругхудышек зачотн выделя ухажер напуга подростков ,-2109
млаш бабушк алеш подоспел гололед обхажива одуванчик ,1163
подвхват старушенц продложа голос сипл простужа певц ,2088
волос пирсинг яркосин кривокончиков субкультур губ колюч ,3387
пряник морожен горл магазинкуп заболелабол сходилкуп покупатьон ,114
обход чувсв тунелл япрост неполадок геофак никогд ,1908
пошел напротивяс женеоткрыва выбрасыват пилион дверьст пилиспал ,2652
понималэт говорилмн безоткатн воспря разброса напива наткнул ,1747
идиотк непрокраш карточкувид присяг сподоб гражданств жительств ,-369
наденьт заня ничерт заночева кульминац примча наивн ,1124
клуб девочк общемпоследн тактрезв кроватьмн даличт учетещ ,511
стажировк перевож влиятельн подслуша нелюбим шеф суббот ,765
подарокодежд одеждахот развелисьещ MPплеер купил недорог зарабатыва ,1366
опек воспитан распланирова никт помога геройств самоустран ,2206
город дедушк поматрос потаска бездн пив заменя ,1335
ребенк нянькикормилиц сраж помест неровн назрева колеба ,1369
заскоч бургер лэнд дискавер миллиард денькмп сторонузакурилнаблюда ,960
умеет схватыва отстаива отзывч отбо лезет готовк ,-1008
заварива обожж кипяток неосторожн утюг поллиц криворук ,3369
освежител сумк шевел хрипл развернут успел прошепта ,1116
заколот дойтиид понятьзач темен полседьм вообш поровня ,2520
марин телефон вспыльчив бди обматер значительн насчет ,2153
подонк бывш клуб ушатыва синефиолетов почкиписа эмоций ,4277
юльк андре андр нимпроща тататат сппрашива юлькин ,3326
подлежа восстановлен бумаг подстав рабоч крупн некотор ,1215
пьет таблеткииногд кмпиб принимаетреагир какоенибуд приписыва посаж ,1447
вместепойд продуктычтоб постояннозвонит вкусностямитепер тебепокуша желудокн накормит ,2002
бразил уезжа океан блондинок товарищ супруг какихт ,1719
плач относ пятьшест экстрасенс колд оборудован привлеч ,1779
задав отомщ ненавидим чиновник правосуд отступа достига ,6358
жилиб кпм разбира изменя кажет глуп урод ,2344
когдалиб отдален спросон оправдыва какогот убийств проснул ,1434
интернет специальн выльет виагр фармабизнес закроет буржу ,432
мужык товарищ невпуписечн вернуласьт любовьлюбов залюб кароч ,2854
детсад братик айфон найт взял нов пмп ,-611
неженат полога шляп агенств разумн уточн наткнул ,-666
утихомир задева замкнул враг придурок избега обзыва ,1791
самостоятельная армиинервн веселилисьгулялиотдыхалиучилис тянетсятр ремонте плохогоучеб вожатойрисова ,190
вместедруг недоступ душ сплю рыда проход где ,2556
ближн зарубеж всех выключ неизвестн сошл недел ,1482
облажа спотыкн упад ржут опозда подробн мастер ,-326
йух ладошк стукнул порыв эмоц колен посла ,3773
доверя подкупа бизнес детищ собствен налогов подруг ,3432
относиласьн пап нейтральн натвор плеер вчера вечеринк ,2515
мч достаточн наташей нужначерез октрыва голыйвообщ проблемойзарабатыва ,4780
шифрова сюрприз сутк наобща удруча застыва компромат ,2851
выпечк подкармлива колготк коллектив девчонк разбира обсужда ,254
коллект дружн четырехугольник отмазыва плз прикрыва задержа ,2226
вуз диплом предмет сдат перезачтут наткнут дисциплин ,1844
невозбужден безлимитн дробовик впроголод кред пользован чмт ,2584
лесбиянк гендиректорш растерзан обед перемыва отпущен взят ,1794
оскроблен самт злопамятн вспыльчив припомн терпелив обвинен ,2888
договор август подписа USD турзаплат заключен уважительн ,919
настен календар стад подар больш трет рак ,4849
впуска выбижа уйтисовс меняуда кирадоч корридор жены ,5602
пошут пишеш заполня переглядыва левш загранпаспорт анкет ,3508
тубик вылечиласьтольк вдовол прлежа туберкулезн досда заразн ,3078
ярост унижа занаркоман поглум трл сожительниц препятствова ,3680
жизнью… чмырдя брешет чернух начищен подсид маниакальн ,3300
прохожден подсиж банк безупречн умеют спланирова кондиционер ,3784
подушечк чатрулет силиконов подвож помад экран однокурсниц ,3745
магазин кофточек нефиг манекен щелка примеря щелкнул ,865
крыс вылеза рожден спарива крысолюбств самосборочн животноненавистник ,1870
ириск ржат ваш дирр ослин вждав тшак ,1108
дед бодр бабул расписа активн танц дедушк ,2291
сирен тул буха разбрызгива мнепоматрос матершин ктож ,3450
фотик эротическ фотк назаддума вытащилиоткр присмотревш прилага ,757
втянул волн изнеможден яшлюх зазыван общалисьпот подружкажизнерадостн ,2001
вич понялд спидозн деньон пошатыв беспорядочн дамск ,7285
оказа продл недовольн контракт опозда больничн замечан ,957
драматизир выкарабкива подсмеива выспрашива феерическ поразн точност ,-179
гитар засохлисравнива написат сделатьпот бренчалаещ умеетхот советует ,298
приглашен понравиласьпристрел еголицемер невесты барск пареньс часполтор ,-297
подоконникомгд работунакоп квартирагд разлучил агентство дуракрев шлоб ,4868
зарегистрирова обязательств холост мужчин смех неужел сайт ,2227
поллет провод линейк просидел увлечен посидет радостн ,2001
завистниковчерез студентпристрел приколомн завестигосударств месяцевмогл вместереш рождаем ,1684
подписа обучен казначейск налогообложен дурост налог факультет ,902
сентябр машинеувидел дебилок видыва срул парадн дожида ,2760
контрольн траха отмет сентябр период рожа рожден ,4050
нетнек стряхива градусникразб больницупроб вернулсяобнаруж принятьдожд кмпя ,3307
зуб отпусктак воспалилосьдеснащекапазух зубаид всеконецотмучаласьн спасатьдл всеготовсьплис ,2220
пешк настроениц обсох зенитн растряст академическ складк ,-741
зеленоглаз томуж этомочен подругойт сказалауведет говоритпьян водиш ,2506
мамаш прожжен прекраснон унаследова невменя безрезультатн хром ,1879
пижамн ганжубас прогуля ктонибуд приятел вечеринк мота ,-315
ошибк млн пожалел документ вернут увол момент ,2044
сапожк привет адрес ессесин каблучок замшев восстановк ,5672
милиц перевернут диктофон союз пирожк послушн яблок ,2367
флюорограф поликлиник жительств пройт денг денюшк прихож ,-685
надпочечник твердеют вырабатыва перемота медобследован груд возбужден ,5951
одногруппниц ноутбук необеспечен покрупн циничн подлеж компенсац ,298
возьмет когонибуд ребеночк залет фраз поздн понятн ,2840
ангел бессознанк отлежива насторож бесчувств опухол стабильн ,2060
анонимностион смотретькт формспирнг пожалеет андрогин мужеподобн галочк ,806
домохозяйк нянч садик планирова представля два зарабатыва ,-2624
двер промерзл жмакан пролеза открыва стопицот бант ,1156
полтрет прогрессир выспа встава кпм спат получа ,-799
флэшкуобрадова отличнотут отдаювс утромподхож находкапришл нужна назнача ,2059
развращен студентокмедичек жлобств убира притон стрижк критик ,-1849
доч мирн втро невыносим шлюх алимент содержа ,3275
вуаерист нудистск порнозвезд призван разраз неосторожн посет ,1887
руководител разработа сдаеш надоел аспирантк кастинг церемон ,1568
гостин ничегопосмея забылнаутр куритьид храпя реагируетн кроватиел ,1784
посла тинейджер воплощен вьют вымышлен сын мечта ,1633
шестьсем бодрствован неясн поспл отклонен умудря вечерн ,1064
геометричк HTCкуплен телефон геометр подумалачт толстовк выпада ,2685
блузк нищ радикул филипн бабушк сшил королев ,1791
новеньк фирмочк женщинекотор матпомощ зти корпоративеста непримечательныйн ,1380
стычк гражданин ворк однокомнатн здорова матер опя ,1431
вконтактеон красиваяподума свиданием общенияон оказываетсяон сказалагд годм ,-2220
вологд хибар истокамт светфигв микрорайон неотопля жоних ,1858
мужлан отошел черств надава цветочк трешк привел ,2695
знаменательн разгреба прожда новорожден выписыва фотоаппарат дню ,3168
стерилизац усыновлен выкидыш абортивн врач либ подкуп ,6246
бабушк наверх дива спуст звал запсихова ползк ,3592
аккумулятор влажн копилк нехил заряд арест налож ,3085
школ сентябр валокардин болниц пайдевочк бабушк домашн ,4246
мотивирова парняэльф атлетическ качалк тренировок накача посещен ,1229
тронутон общалисьприч гдезовут нейзасел получилон подругажда улицедожд ,989
отпуск звонок срочн начальник расскажеш тудат коллег ,1971
песочниц прыгнул сестр естьмн подкусыва пуховичок цапнул ,3543
операц мимоход несуществен поймеш вопрос действительн дета ,1194
спрашиваетсякак детонатор свадебк свитерок свяж подогна многомн ,-705
переписыва ma сестр написа стыдн разб почв ,1115
бфг идеш сдруж филиа июл сотрудниц сотрудник ,-2910
слуууша мжно замуж распоряд замерл постройк женитьб ,2761
внук сынарод заберемена полслов отслуж побок элитн ,842
книг планшетн выдержк зачитыва просматрива светофор уткнувш ,1226
слетел инф курсовыерефератыфотк насро сейв говоряон форматнул ,-142
класс побра премир загноб вывернул забыт перешл ,-1123
пересля дедушк развлекательн распечатк умерш настойчив заведен ,733
переживет широчайш круг набуха собутыльник делов камн ,2053
убира легкост выдержива отремонтирова собеседник гвозд растут ,1735
ушло матомтак общаютсяяблочк семьягруб выпитьн ушиуж подумаладет ,1754
благородн скат мол тамжив относитсян матерьюинвалидомс будетв ,827
вышел торб свиданк пригрел наивност вопрек заочниц ,2540
бумажник дядечк подпорч фокусникиллюзионист проа испаря плюнут ,489
неделюскладыва неймн пойдеш хочу проведа покорм поработа ,1346
фэйсбук профайл вымест провернул саш установ могл ,1022
неотраз мальчикахт мужчин наверста сорокалетн понялачт измен ,1481
вмест спуст поджида критик жит отцовск ребенок ,1494
гриф инфаркт бабул полапотолк размя штанг саранч ,1874
улетуч плафон аутист люстр эгоизм ребенк родител ,845
стеклопакет реновац хрущевок постав обожд установ комисс ,753
проектировщик угодническ техдокументац штудир здес приоткрыт холу ,2357
залет упадет ленив шевел дрян привыкл разниц ,756
жарен ожирениеуб мамочка отбивн поджелудочн печет варен ,-526
назадкмп отношенийрасста парняс узналачт годовщин нынешн бывш ,1015
уродкмп следующ тридцат отня спортивн подстав выпив ,2806
лобк хй военкомат медкомисс оцен выбр спор ,1498
лабрадор йокширск проплачива булька собачник собак сшибл ,1277
проткнул колес сдвинет выбес встанеш проед отъеха ,5048
скребет минут одея ктот книг родспальн придавлен ,2394
таг разочарова имеет умеет друз мам приличн ,-418
куша универск трапез разбуха стоматологхирург отток огомн ,620
чтож картридер взыщут терминальн ремонтиру итжизн итшник ,1677
историявынужд заткнут разноглас привязан исчезл переживан замужеств ,1663
либ убежа влажност паукптицеед террариум зверушк питомец ,1490
псин хозяин вдруг сознан меркнет болонк стадион ,4369
милиц засален брызж такое… нестрижен егонет гейсайт ,2122
далекодалек запекш подставк ногойслойн кривоват корк оденеш ,1376
жаждет заправл льготн рубл лаборант заочниц аванс ,882
убед эскимос толчок братаинвалид остеопороз смороз ярмарк ,1366
пинкодым платитькмп нетронут накапа сумм карт сопутств ,1201
отц зач компаньон давност знает действительн ухудш ,3370
ганка хант свадьб кратк вов расскаж отец ,2796
денегзаплат вытаска сказатьдом приложутк платномлет потомв учебы ,867
прихватыва хренушк знакомойкогдат зазыва телок подбива поеха ,887
бутов савеловск просыпа алтуфьев деполадн ужос увенча ,1191
военкомат диплом диагноз залечат заяц врач гипертон ,912
военкомат повестк отсрочк пришел ноябр июн отня ,1252
протезирован зуб пломб ценов периодонт перелечива эмал ,1829
боялась… умер… уйдет… кодат упрос предыстор искусствен ,2230
чоп попов яохранник вышибал дизел стебут отслуж ,1677
линуx бекап нелицензион инциатив freebsd забекап форматнул ,1023
плеер симпатичн раскваш влета размах вдребезг выпендр ,1963
суш зуб пробес скобк уродск перекос надв ,1698
паук паучар засуна истерикуплакалатрясласькрича шапкиварежк пописа фарфоров ,1361
норков макдональдс шуб изпод обозва отделен шлюх ,1443
придра руководств положен обучаем мегасрочн прибавк подгоня ,2611
задействова девушкойпмп прогулкитяжел инсценирова виновник боев мук ,7361
обьяснен поводат арбуз выкрикива пробега невзир одногодк ,5426
обременя приватн завож дважд мужчин недолг даб ,1613
стрем девчонк огреба препод импровизир ненавиж лохмат ,3474
пмсосен обольща невыразительн иначе…пмп добивалсядобива мазохист впрям ,2987
частот кохлеовестибулярн головокружен переболел орз китайск диагностирова ,5173
буженин копчен ангин солен привезл необходим отдельн ,-2599
сумк постира испорч косметик вынюхива эпическ перемылаперечист ,2094
сосиск пюр бесплатн дают ошеломля завтракиобед платник ,-3143
прессингова вшивеньк педак детиблизнец потеш самолюб обзванива ,3281
кипр покорм сдохл сумасшедш забыва съезд кот ,2814
гоповыходк дебиловпереостк выродок фсб переступ прокуратур аттестат ,2741
июл условн наступа переклин истеричн пасс соглаша ,2896
неужел длят полужизн бегемот постоя жру нехватк ,1929
официальн совершен рассказыва спрос знал развод поч ,-1729
налед машин крыш ремонт разб цен коп ,2882
тролейбус наушник бабульк болта харкнул бабус оборзел ,4527
проездн сообщен кошелек онаруж визитк естесствен снимут ,2360
полуслеп сколиоз помаха горбат полставк приговарив законч ,8908
братик руководител неудачник историиснача подрастеш химб маленьк ,4265
машин расказа застрахова собствен всмятк поцарапа вожден ,1804
флешкугд материаловфот презентациючт музеевперевод сохранилаэт бацпотеря русскийпот ,2691
мелк родителипенсионер выздоровел ограб флирт побольш больниц ,3757
готовыд возьмеш мышеловк занест лаборатор сыр начальниц ,-2123
дневник ненавидитсчита алкот ядевушк зазрен описан переночева ,4435
попытк молодчин опаньк наверста дыхн сапожник родительниц ,4124
опорамо сжав боженьк этап ворон правнук променя ,4522
шата сумочк уступ хам дам зуб назва ,5993
аудитор дека фраз нагна типаон пузырек ушлепок ,4310
вагин фамил депресняк загвоздк жру хоч принципиальн ,3575
рассказва девушкаж многочислен онат полноч пообща попробова ,-532
цитирова разносторон цитир производ личност статус разочарова ,-3012
Forex стабильн валютн счет влож сво трейдинг ,4020
жизнишок пропуш вылетет кашля вырыва доктор болет ,3495
пидееец домыва протяжн преувеличива сквозняк мусоропровод красавчик ,2143
предк шкаф фильм пап финлянд переглядыва просидет ,2930
поскольк хлам грязныежирн тожепмп дверейкран блокнотовчитатьписа мамин ,3519
перешагив вывернув непроходим упрямств вынужда обделен вынуд ,1482
ляпнул кисл сдур сотрудниц грустн расплака погибл ,7008
килограмм толст вздува туловищ жратв сложн брюх ,3986
вставан ногиотказыва избранниц услов переоформля отказыва предпенсион ,4353
распадет задокументир неоткуд насеком галлюцинац воперв вовтор ,5208
любим командировк вердикт забавн убежден относительн задержк ,4247
пережда кредитор лабуд нехорош приеха долг романтическ ,4631
кабинет ноутбук интерактивн компьютер проектор урок посещен ,5333
